{
  "protocol": "baijin-gate-production-decision/1.0",
  "decision_id": "gate-production-decision-denied-001",
  "task_id": "task-gate-production-002",
  "run_id": "run-gate-production-002",
  "repository": "shunhang776/xinbaijin-mcp",
  "branch": "dev",
  "candidate_commit": "2222222222222222222222222222222222222222",
  "reviewed_commit": "2222222222222222222222222222222222222222",
  "review_commit": "aaaaaaaaaaaaaaaaaaaaaaaaaaaaaaaaaaaaaaaa",
  "chatgpt_review_result_id": "chatgpt-review-result-changes-001",
  "l4_run_result_id": "l4-run-result-manual-001",
  "review_verdict": "changes_requested",
  "l4_final_state": "MANUAL_REQUIRED",
  "decision": "denied",
  "reason_code": "chatgpt_review_not_approved",
  "required_conditions": {
    "checks_passed": true,
    "chatgpt_review_approved": false,
    "review_readback_verified": true,
    "l4_accepted": false,
    "branch_head_unchanged": true,
    "no_stale_review": true,
    "no_repair_guard_block": true,
    "artifacts_verified": true,
    "policy_passed": false
  },
  "source_artifacts": {
    "l4_run_result": "artifacts/l4/l4-run-result.json",
    "chatgpt_review_result": "artifacts/l4/chatgpt-review-result.json",
    "l4_dry_run_artifact": "artifacts/l4/l4-dry-run-artifact.json",
    "gate_input": "artifacts/gate/gate-input.json"
  },
  "created_at": "2026-06-27T00:00:00.000Z"
}
